date,rating,title,review_text
2025-03-08,N/A,Be very aware of hold baggage.,"Booked the holiday of a lifetime - no problem.Website clearly states ""Additional luggage can be added after you have completed your booking"". This is NOT the case, at least not without stress and difficulty.After having to write to Exoticca to find out the cost of hold luggage on this holiday - and waiting over two weeks for a response - apparently we cannot guarantee that the hold luggage wont be left at a transit airport or know how much it will cost for it to complete it's journey to the holiday destination. This is just astounding! Or we spend a 15 day holiday with just enough clothes, toiletries, snorkels and diving masks that will fit in a cabin bag. Ridiculous and very, very poor."
2025-03-05,N/A,Can't access support during trip,"The pre-trip communication was excellent. They were sending updated information regularly and confirming all the activities and pick ups. Once it got to the flight, baggage was not included. This ended up increasing our cost by 558.88 Canadian dollars. That's a large unexpected cost. I think that's part of how they advertise cheaper costs. I tried to get support from them regarding this but did not hear back. At our hotel in Jaco, Costa Rica, we were provided with a room with a view of a large apartment building, and could not see the beach or the mountains. I asked for a room change and was told no. I reached out to Exoticaa to assist on my behalf and they did not respond to my concerns. You pay for a guided tour but receive no support during the trip if anything goes wrong. They essentially plan a trip for you, and then if anything goes wrong you are on your own. Buyer beware. And verify baggage costs as this will add anywhere from 15-20% of your trip costs."
2025-05-11,N/A,"Esy to purchase, no CS (NONE) post purchase","I have not traveled with them yet - this rating is for their Customer service after sales before travel.Getting to their Sales Agents was very easy and the process to buy one of their tours was efficient and effective.After that, the Customer service is horrendous!Calling in to CS entailed a 90 mins hold time - no thank you!Reverting to chat entailed a 32 mins wait time, only to be flipped to 1.5 hrs after 20 mins!!Writing to them would entail a wait of (hopefully) 4-7 business days before they respond.All this in search for simple answers to a few follow up questions!I suppose if the tours are well organized, then CS is immaterial at the end of the day. I dread the possibility of needing to reach out to them during the tour!Until I experience otherwise, I cannot recommend Exoticca for their non-existent CS!EDIT 5/11: Am back from the tour.  The tours went well with the local agents (Beyond Jordan / Planet Tours in Egypt). We enjoyed ourselves and had a good time, albeit it was a very packed trip.My luggage missed the incoming flight on the way to Jordan, and I reached out to Exoticca for help via their help link - no response to date. Luckily the ground agent in Jordan was helpful and we sorted the missing luggage the next day."
2025-03-03,N/A,This company keeps saying call customer…,This company keeps saying call customer service i was on hold to day for over an hour and could not contact them they emailed me to contact but that person you can never reach him or her i ended up buying an air ticket on my own instead of the hassle a loss of $1000+never again this travel company
2025-03-07,N/A,Price was cheap and that should have…,"Price was cheap and that should have been a red flag. You get what you pay for. We stop at some significant places and were beautiful but no time to actually see anything up close. Every time the guide said we had an hour free to eat and use restroom, she kept talking until  30 people only had 10 minutes of free time. Some of the orders of destinations could have been reversed to give more time. Hotels were OK, clean for the most part, ease of access to dinning in the evenings. At destination locations we were rushed through areas of great photo opps and too much time spent in areas of no meaning. Have traveled Europe several times on our own and I guess we will go back to that. Overall experience? Will not travel wit Exottica againBooking ID is 2024308780"
2025-03-01,N/A,Valli Canada customer service Exotica travels,"Valli CanadaI have booked a tour in May, 2025 for Peru with exotica. I asked them not to include us night tour of Cusco. When the itinerary was sent it was included. My middle name is spell at wrong. The flight times have not been given.I asked about paying extra for checked baggage and I have not had an answer.Instead I have had a reminder for the rest of the money owing. If this is the case before we start our trip, I am wondering how our trip is going to be. I have tried to call them and have been put on hold for 25 to 30 minutes at a time several times. Their customer service is quite lacking in communication and service. I was going to book another trip but now I have second thoughts."
2025-02-26,N/A,Morocco: disappointed,"Several issues with this trip (~10 days in Morocco, Feb 2025):-The tour was advertised as requiring good physical status due to moderate walking, however the tour had near zero walking and 90% of the time was spent on a bus. This is not what we were looking for.-Most of the ""charm"" hotels were solid 2 star hotels with not very reassuring reviews. The experience proved the above.-Too many cities and territory covered with little to no time to really explore the place on your own. Only one day was on our leasuere-Extremely overpriced places where we were taken for lunch-Visited several overpriced tourist traps where there was a full display of sells and there was minimal room for self search of shops or decisions about on what to spent out $-Tour guide was not the best, sadly. He was very upfront about his expectations on tips from day 1-Additional tips were needed for local guides in addition to our tour guideNot recommended"
2025-02-25,N/A,Unreliable and terrible customer service with no personal touch,"Dealing with them has been excruciatingly painful so far. There is no personal touch or a sense of reliability. Their wait times on the phone to answer any question is horrible, much longer than the estimated time that they give you. We haven’t been on this trip yet but already had an issue with our flight booking initially which they booked us on basic Economy instead of Economy without even telling us that is what we were getting. And then to change that from basic economy to regular economy we had to contact the airline and pay upgrade fees to get to main cabin class. Exoticca was of no help and they said there is nothing they can do about it.Our trip is coming up in April 2025 but they have now changed our hotels after having committed to the hotels that we had reviewed with them in depth and they did not even inform us of this change. Their alternative hotels they have booked us are NOT the same level or category as what they had initially offered during the booking.  We are now waiting to speak to a customer service rep for over 1 hour and yet no one answered. To our utter dismay, we finally hung up. We have travelled to many places in the world and dealt with many travel companies and this is by far the worst experience we have had so far. We are afraid of any issues we may run into through this trip and their unreliability makes us very nervous. We DO NOT RECOMMEND them to anyone!!!!"
2025-02-23,N/A,Don’t use,"Don’t use, they will charge you extras. I booked a holiday to China. I entered my name 3 times and it still got it wrong. I have to pay £665. I explained I do have a disability and therefore did see the error. They did not answer my question about their policy on errors made by disabled people and said I still. Holiday is already ruined before it has started and it’s a big birthday! Please don’t use this company!"
2025-02-21,N/A,EXTREMELY DECEITFUL AND ZERO CUSTOMER SERVICE,"I approved a ""deluxe"" travel plan to Morocco leaving Feb. 16.  This itinerary had flight dates and times but no airline names.  I requested airline names along with other information like the hotels I reviewed from itinerary were NOT 4 and 5 star rated hotels.   Was assured they were and that I could not change them.  I paid for the trip BUT when I received the itinerary the flight information changed dramatically - 8 hour layover at JFK - not acceptable.   I contacted the sales person - Michael.  NOTHING.   I contacted via email and telephone customer service.  Hold times over 45 minutes - all they could do was ""escalate"".  They booked us on Jet Blue - not an airline I would ever use.  The entire experience was horrible.   Their customer service was non existent their feeble attempt to ""escalate"" produced nothing viable.  I would NEVER USE THEM AGAIN NOR WOULD I RECOMMEND THEM.  VERY DECEITFUL AND LIARS."
2025-02-27,N/A,Extremely Disappointing Experience with…,"Extremely Disappointing Experience with Exoticca TravelMy wife and I, along with two friends, recently completed a 13-day trip to Greece in October 2024, and it turned out to be one of the most disappointing travel experiences we've ever had. Greece had always been a dream destination for us, but Exoticca Travel’s mismanagement and poor customer service turned our long-anticipated vacation into a frustrating ordeal.Major Issues with Our Trip:🔹 Unnecessary Itinerary Disruptions: Upon arriving in Athens, we were informed that our entire trip had been rearranged due to an impending ferry strike—something that reportedly happens every year. Despite this being a predictable event, Exoticca made last-minute changes to our itinerary and accommodations, causing significant frustration.🔹 Terrible Communication & Customer Service: Throughout our trip, Exoticca’s customer service was nearly nonexistent. Despite multiple attempts to get assistance, responses were slow or unhelpful. When we called to complain about our itinerary, we were told to use the app—only to find out it was never updated. We had to constantly check with hotel front desks just to know where we were supposed to go next.🔹 Subpar Accommodations: The hotels we were promised did not match the descriptions in our package. Some were dirty and lacked basic amenities. Out of all the places we stayed, only one could be rated above 1.5 stars. One hotel was located directly behind a nightclub, and the loud music and pounding bass kept us up until 2 AM—despite us having a 6 AM departure the next morning.🔹 Disorganized & Exhausting Transportation Arrangements: Transportation logistics were a complete mess. We experienced long waits, chaotic transfers, and rushed schedules that left little time to actually enjoy our destinations. A prime example: our ferry from Santorini to Paros left at 1 PM and arrived at 7 PM, giving us just enough time for a quick dinner before an early morning departure. We saw Paros for a grand total of 30 minutes—at night.🔹 Lack of Accountability & Poor Problem Resolution: When we raised concerns, Exoticca showed no willingness to resolve the issues. No compensation was offered, and we felt completely ignored. Even after being assured that someone would contact us about our complaints, over three months later, we are still waiting for a response—except for a follow-up email encouraging us to complete another booking.🔹 Deceptive Credit Offer & Misrepresentation: One of the main reasons we booked with Exoticca was the promise of a $4,500 per couple credit for future travel. Exoticca misrepresented how this credit could be used. We were explicitly advised—and had confirmation from our travel agent—that the full $4,500 would be applied to our next booking, which was a key factor in our decision to book the trip in the first place. However, when we attempted to use the credit, we discovered it was capped at $450 per couple per trip. To fully use the credit, we’d have to book 10 trips in three years—an unreasonable and misleading offer that feels like a classic bait-and-switch tactic. Exoticca clearly was not upfront about how this incentive/promotion worked, and had we known the truth, we would never have booked with them.Final Verdict: Avoid Exoticca TravelThis was our first experience with Exoticca, and it will certainly be our last. Instead of a stress-free and enjoyable vacation, we endured mismanagement, misleading promises, and poor customer service. I strongly advise against booking with Exoticca Travel. If you value transparency, reliable service, and a smooth travel experience, look elsewhere.Booking # CA-EX2024266898My travel agent will give you my phone#"
2025-03-12,N/A,Pre-trip Nightmare,"In all of my dealings with Exotica I had let them know about my mobility issues.  I booked a trip to Portugal for late February 2025.  In mid January 2025 I confirmed that I could use a mobility scooter on my trip.  About eight days before the trip I asked some questions about the mobility scooter and the hotel.  Exotica never answered my questions and instead told me that they may not be able to accommodate me.  This was seven days before the trip.  I replied and pointed out that I had already been told this was okay.  Since then I have sent several emails and spoken to them on the telephone.  I have been told they are working on it, it has been resolved, they have pushed the matter forward and so on.  Of course nothing in writing, no phones calls from them and when I requested to speak to a manager, they promised me it would happen and I am still waiting.I am concerned that when we go I will end up battling the tour guide, while it is not his fault; I could end up not being able to go on the tour; there will be other problems; and if there are in country issues I will not get a response from Exotica.  I have noted many posts on many forums that are talking about the same or similar problems.  It also seems that Exotica says they will do something or pay something and then just ignore their resolutions.  It appears that they believe people will just go away.The trips look good but their customer service is extremely poor.  I will let people know what happens with the actual trip.If you have had experiences with Exotica (good or bad) please post about it.Reference #CA-EX2024288728With one day to go, the trip is supposed to leave tomorrow, Exotica is still ""working on it"".  I have to wonder if this is a scam and they are hoping I will cancel the trip.  That way they can blame it on me.Despite all my attempts to email and call Exotica; and despite my suggestions to resolve this all I have heard from Exotica is ""we are working in it"".  While waiting for our flight to Portugal at the airport I arranged for an electric scooter.  We still had not heard from Exotica, we did not know if we were going to be able to take the tour (once in Portugal), we didn't know if we were going to be able to use the mobility device, we didn't know if the tour guide knew about this and we didn't know what Exotica was doing.  As we were boarding the plane I got an email from Exotica that they could rent us a wheel chair or scooter.This was too little too late.  I have to wonder of their team can read and understand all of the information we had sent them.  We were also extremely concerned, given Exotica's track record, if we were to have problems on the trip.  This company has failed up completely.  We also believe that all of the advertising and assurances about caring for their customers, responding to customers and trip protection is false and not to be believed.We won't say don't sure them but be very careful as even written promises may be broken."
2025-02-16,N/A,Appalling customer service,"Appalling customer service. Inflexibility, unable to apply logic and empathise. Tardy responses with satisfactory explanations. Robotic replies. Unsatisfactory substitutions. We are now starting our holiday in a poorer frame of mind than we would have liked. I would strongly advise anyone to avoid this company. What may seem like an appealing headline price is a false economy."
2025-02-15,N/A,can't find some of the review trips,"Hi I've been reading a lot of reviews which are positive but some have no mention on which trip they went on, so feedback doesn't give an good overview or am I just missing something"
2025-02-09,N/A,better response to customer requirement…,better response to customer requirement the person booking the travel disappears and you get no help from any one very bad experience
2025-02-06,N/A,Terrible accommodations,"Things have been going from bad to worse on our 17 day trip with Exoticca.  From unsafe shuttle to airport to awful hotel after awful hotel - after we paid for superior/luxury rooms - I would recommend that you look at another travel company.  They do not address issues, rather, they pass them on to their local staff who can’t do much for unsanitary hotels and we are left with bad travel experiences.  If you are looking for a pleasant trip, this is not the company to go with.   wish I was home already"
2025-02-12,N/A,Haven't even gotten off the ground yet and.......,"Haven't even got off the ground yet and already I'm getting frustrated.  Trip booked in Dec; signing into site worked once.  Now can't log into site or app no matter what I try.(resetting password/re-registering) the only information I do get is that I have not booked any trips.  When I notified Exottica about this I got no response. Hope the actual trip works out better.**Update 2/8/25:  ""Amazingly"" sign on work shortly after the post.  HOWEVER, after writing down the username and password that worked, and trying to use it today it no longer works.  States password incorrect; so tried to reset password.  Just for giggles I entered the password I just used and it shows up not to use the ""current"" password ???  How can a password be incorrect AND current at the same time?**Update:  Exottica contacted me via email with the solution to fix the problems.    Now to start packing :(Thank you for being able to resolve this as painlessly as possible."
2025-02-06,N/A,Miss sold holiday,"When I first made my enquiry with the travel consultant for Exoticca back last year I made it clear that although l'd be traveling by myself I didn't want to be on my own. I wanted to travel as an organised tour group with a group director/coordinator and same group of people travelling as one group. Even after booking the trip to Costa Rica l rang back again with concerns over the booking confirmation details and she reassured me in writing in an email that my tour would be FULLY escorted and with a tour coordinator and same group of people. There would also be a welcome meeting on arrival. So after that reassurance I remained happy with my booking.Then the problems started withmy flights and my last one coming home being cancelled. I rang up to discuss it and was told after booking the trip they don't have anything to do with the flights and l'd have to sort it myself. I booked the tour as a package do this was a shock but she was adamant she couldn't help me. I rang the airline and they said they couldn't help me because l'd booked through a travel agency and they should sort it. I ended up having to put a formal complaint in to the customer service department and after many weeks i eventually had a new flight, plus they arranged a different flight going out to San Jose to half an hour earlier because they had me landing at 10.30pm when my tour started before breakfast the following day. So half anhour earlier was better than nothing.I was promised they'd sort my hold luggage out nearer the time and again this was something they let me down with and I ended up taking just hand luggage.To top it off I got on the holiday and I ended up on my OWN. Only seeing people on excursions. None of the above mentioned happened. The welcome meeting was a letter. How you ask a letter advice I don't know,it was rubbish. I felt very disappointed and depressed and made contact with Exoticca who tried fobbing me off saying I hadn't been given wrong information. But after disclosing the email I had they offered me £150 in credit which i refused. I've asked for it in monetary value which has just materialised.I made the best of a bad situationand enjoyed the hotels even though they were some distance from amenities and I enjoyed the excursions.But ultimately I will never be using this company in future again. Please be careful if you like to travel as part of a group because they're just a booking agent and the tours are NOT FULLY escorted."
2025-02-04,N/A,After sale service appalling,"Case ref 03502637Booked a safari with return flights to & from Heathrow, the booking came through with flight out from Heathrow but returning to Gatwick.Raised it as an issue on 18th Jan, have chased repeatedly with no resolution. Emailed the CEO, no response.Still no resolution to what should be a simple issue, not even an update. Appalling customer service. Now writing this review so people can see how bad their after sales care is but also in the hope of getting a resolution on the flights either that or a full refund of everything I've paid so I can actually book a trip with a company that treats its customers with respect."
2025-02-03,N/A,Bad tour leader,"I live in Italy and my family from the US came last year to visit me and traveled with Exotica.We were all very disappointed especially with  the tour leader who was not even Italian, had a strong Russian accent, and knew very little about the country and the culture.  She was also unkind and spoke poorly of the country and that put the entire group in a bad mood.Italy deserves better."
2025-01-28,N/A,No help when my passport money got stolen Peru,I went to Ireland Japan and Peru Ecuador with them ! My passport cash cards were stolen in machu pinchu on 24 September with tourist guide and I was alone ! It was reported to police 3 days latter in Cusco ! In machu people told me they saw my Gucci bag with a local woman who said she will return it to me !My guide was complicit with her and did nothing ! It was a disaster I lost a lot of cash and passport my family sent money for emergency exotica did nothing ! I rejoined group in Ecuador who helped I paid themback with my family remittance !I am sure as I wax alone in m p my guide planned the robbery and exotica reported it stolen in Cusco after 3 days !I had two good trips to Japan and Ireland with them !The treatment in Peru wax shameless I had not a penny only god helped and some private tourists !
