date,rating,title,review_text
2024-04-28,N/A,Do NOT use this company!!!,Do NOT use this company!!!! Non existent customer service- each person supposedly there to help passes it off to someone else. HORRIBLE experience in Brazil & Argentina!!! They are beyond the worst thing out there and turned our vacation into a complete nightmare!If I could give them less than one star I totally would!No one to help; leave you alone with no idea what to do; won’t answer phone calls; descriptions of activities and hotels are completely incorrect; in country flights they put you on are red eye and you don’t know about it until the day before you leave (making it next to impossible to re-book);these are just a few of the worst things …. I’ve never been so frustrated in my life.I met 2 others on vacation here who said the same thing about this horrendous company.
2024-04-27,N/A,Avoid Exoticca Egypt from Bristol,"Avoid, Avoid, Avoid!!! 'Exoticca is not proper travel agent'. ALL external Flights were changed, multiple times and with huge delays, waiting in between, and cancellations. Exoticca were of no assistance, they just refer you to talk to the airline personally. I do not need a travel agent for this I could have just booked better flights myself. Changes made less than 12 hrs before departure from the UK.The flights advertised on their site do not represent the reality. 16 hrs to get from Bristol to Cairo (normally a four-hr flight) with two stops (one advertised), Cairo to Bristol 20hrs (two stops) and lost luggage as a result. I would not recommend as you are stressed when you arrive and stressed when you get home. Combined with very early starts from 3am to 5am every day.The three days onboard 'cruise' is one day cruising, two days accommodation on the boat which is docked and joined to two to four other boats, which you walk through to get on land!!! Food onboard is positively average. Only one of the advertised hotels were superior, the others were remote (taxi to any shops or restaurants) and distinctly average.Too much talking and restrictions from the guide, who was extremely knowledgeable, but did not take into consideration the guests need. No attempt to get to know our names, even though we were with him for 7 days. We were treated like high school students.Very slow and longwinded allocating rooms at destinations too.Meet and greet and collection from Cairo airport was exceptional from Planet tours."
2024-04-27,N/A,"""Treasures of Anatolia - Turkey""","The hotel choices in Istanbul is very far and inconvenient for us tourists to visit the city centre. The taxi fare from this hotel to city centre (Istanbul) is very expensive. And if you take the public transport, it would take 1.5hrs - 2hrs just to get back to the hotel from the city centre. Exoticca contracted a travel company from Turkey, Euroriente, which basically runs this trip. There were no restaurants choices for our  lunch stops. They always brought us to a ""contracted restaurant"" by Euroriente which provides no other choices for our lunch/meals. Most of the time, me and my wife don't eat lunch as there were no other option to choose from.  The optional excursions offered by Exoticca/Euroriente are very expensive compared to the on-line prices from Get your Guide. For this reason, I booked my optional excursion/activities with Get your Guide. I'm not going to recommend the "" Treasures of Anatolia - Turkey"" offered by Exoticca even though the itinerary or places to go to were good."
2024-04-26,N/A,3 South American countries  with Exoticca,"Whatever Exoticca promise on their website maybe true if all goes to plan .When you need help in a foreign country , you get NOTHING  !Left stranded at Peru airport for 12 hours to sort out onward journey to Argentina. Local guards not  great , Peru was the best of the 3 and they vary in each country .In Brazil 2 guides met us and it was late and they didn’t speak English ( not their fault , but…. Not what the website says). Nobile  hotel in Brazil at best a 2*_ Dire!Rest of the trip was fairly good but what they did to us in Peru was very irresponsible. We were the only ones at the airport to Buenos Aires: everyone else seem to know and came in later except for our tour guides who picked us up 🤦🏽‍♀️"
2024-04-24,N/A,Terrible customer service,"We wish we read all the ‘one star’ reviews before booking our trip with Exoticca.Out trip (May 20) hasn’t happened yet but we’re already deeply concerned that the trip would ever happen.First of all, the customer service is terrible. The wait time of a help line is incredibly long and they always recommend to email instead. When emailing, you need to wait up to 3 weeks before they respond. After numerous contacts by phone and email, our problem remains unresolved.Instead of enjoying the preparation for the trip, we’re feeling stressed out. It started with a wrong personal information during on-line booking back in January. It took about 2 months to fix an error by issuing a separate ticket for one of the passengers (for the additional charge of $452). However, Exoticca made another error during fixing, and another passenger information is incorrect now. Our trip is less than a month away but the error has not been corrected yet. There is a fear that one of the passengers will be rejected by the airline due to an incorrect personal information.Perhaps this review would alert future travelers to be extremely careful of using Exoticca’s service."
2024-04-23,N/A,2024 Trip to Portugal,"In March 2024, my wife and I traveled to Portugal taking a tour arranged by Exoticca Travels. While the tour was generally arranged and executed well, we had a problem during our return trip to the US. On the day of our return trip, we were dropped off by Exoticca at the Lisbon airport with less than two hours to complete the boarding process. Due to extensive lines in Lisbon airport, we were unable to reach the boarding gate in time before the gates were closed and therefore we missed our flight. This required us to rebook the tickets for our return trip at an exorbitant price. Since we had purchased Travel protection by paying the required additional charges, we tried to contact Exoticca numerous times (emphasis on “numerous”) via e-mail and the US Contact number provided (1-888-488-0592) to find out what, if anything could be done to help us regarding this matter. (Note: No other contact information was provided by Exoticca for Travel Protection claims/concerns.) Note that no matter what time or day we called no one would answer the phone. Despite our numerous requests and attempts at reaching Exoticca, they never reached out to us to discuss this matter. In fact, the letter that I wrote regarding this matter and mailed to their Corporate office in Hartford with a request for receipt confirmation was asked by Exoticca to be held at the Hartford US post office and never accepted by them.I am writing this review to alert future travelers using Exoticca to be extremely mindful of Exoticca’s total indifference to customer concerns and requests."
2024-04-22,N/A,Stay away from Exoticca - part 2,"US-EX2023177375.  We are now 7 days away from our trip to Iceland and Exoticca still has not fully resolved our situation.  On 4/17, after many, many calls to customer service, I finally spoke to Milda in customer service who explained we cannot communicate directly with FlyPlay airline.  I was told that we must select and pay for our seats and pay for carry on luggage with Exoticca.  She said we would also check in for our flight 24 hours in advance of our trip by calling Exoticca (not the airline) by calling a phone number that we would receive by email. Fine. After many, many calls to customer service we finally were told why we couldn't access our flight info on the airline's website. Finally, someone at Exoticca shared these important details with us. Milda also told me on 4/17 that my travel partner and I could each bring on board the plane one carry on luggage (fits in the overhead compartment) and a personal item (fits under the seat in front) and she sent me an email to confirm this  Today we received our final trip summary from Exoticca and it clearly says in two different places in the document that we can only bring on board a personal item and it must fit under the seat in front.  Our trip does not include carry on luggage.  So tomorrow I must start calling Exoticca again to straighten it out.  Exoticca - I know you read these reviews.  I am flying out on Sunday 4/28 and I need you to clarify this.  I need you to email me to tell me that we can each bring on board a carry on luggage that goes in the overhead compartment AND a personal item that goes under the seat in front. I need you to do this by Friday 4/26 so that we can pack for our trip.  I also would like a revised Trip Summary that deletes the language mentioned above and adds that we can each bring on board one personal item and one carry on bag.  Finally - Exoticca you said in response to my last review that you messaged me.  Exoticca - How did you ""message"" me? I did not receive an email, text or phone call from you after my last review."
2024-04-23,N/A,"disorganized, time-wasting, poor communication","This tour was quite disorganized with a lot of wasted time and lack of communication. People in the same hotel class were placed at three to four different hotels at each overnight stop. This led to us being hauled between hotels and waiting at each one for loading and unloading. The hotels were variable and often did not put us with two single beds as was confirmed on our reservation. One just had a double bed in a loft up a ladder that felt quite unsafe. One of our excursions was cancelled, but Exoticca never notified us. We found out the night before from the hotel manager. By then, it was too late to book anything else. It took over a month for Exoticca to refund our money.Our tour was of Greece and included various islands. We planned our own activities based on the published itinerary. All but one of the ferry times was inaccurate. They changed the ferry times to midday and dropped us off 2 hours early. We lost many hours when we should have been sightseeing or swimming.When I tried to contact Exoticca various times during the trip, their open hours did not match what was posted on their website. They never responded to messaging on the app. When I finally reached a person, he said that I had to go through the local tour operator. So even though Exoticca took our money, they provided no help or information. I will never travel through Exoticca again.(US-EX2023154404)"
2024-04-23,N/A,Bad experience when arrived at the Rome Airport,"I just got back from my Europe Group tour last March 2024. First off, I am 86 year old and purchased the europe trip with my friends.  As I arrived at the Rome Airport, I asked for a wheelchair assistance.  The airport staff took them 45 minutes to bring me to the baggage claim department.  As I received my luggage, exited and did not find any of my friends.  I did not find any signage from Exoticca.  No one from Exoticca greeted me.   I contacted the 800 number from Exoticca and no one answered, especially with the time difference from United States.  NO COMMUNICATION AT ALL!!!  I ended up taking the Taxi from the Airport to the Hotel and paid with my own money.  When I got to the hotel, I found out that my friends arrived in the hotel an hour or so ago.  Exoticca did not even call me at the hotel to see if I made it safely. When I came back to United States, I wrote my complaints to Exoticca 2 times on different weeks and never did receive a response back, even an acknowledgement from Exoticca would be nice but nothing from them. Bad experiences from the Greeter, Transportation Department and customer service!I never received the call. I called you yesterday and I was on hold for over an hour. Please call me back."
2024-04-21,N/A,If you’re planning to go to Guatemala…,If you’re planning to go to Guatemala tours don’t use Exoticca . It’s the worst experience that i got. No speaking English tour guide. Itinerary not being followed. No communication on what time is pick up time and where to go since it’s not in there apps. Hotels no air conditioner. Very limited breakfast food choices. Very very bad experience . I won’t recommend it. Don’t go with Exoticca tours.
2024-04-19,N/A,No seats on airplane with Basic Economy!!…,"We haven't yet taken our tour of Ireland, but I want to warn people about making flight arrangements through the Exoticca.  We booked our tour 5-6 months ago, paying the total balance of $4,000 several months ago.  We were issued our flight information and given ticket numbers.  However, it turns out that Exoticca never selected seats for us; i.e. we had NO SEATS on the plane! So, when my husband went on the airline's website, the plane was just about full, and there were no two seats together. (He has a disability and I had let Exoticca know ahead of time that he needed wheelchair service.)  They claimed that when their customers choose Basic Economy, Exoticca doesn't reserve seats for them.  They said that we could have requested they select seats for us...but admitted that they never communicated that fact. They also said if we couldn't get on the flight we paid for, they would try to locate another flight and let the group in Ireland know we'd be arriving late.  Thanks alot!"
2024-04-18,N/A,Before you book any trips with this…,"Before you book any trips with this company, try call their customer service see how long you have to wait to get though. need I say more."
2024-04-18,N/A,Bad start in Costa Rica са-EX2024223946,"Currently I am in Costa Rica the tour that we bought with Exotica, first - the tour says 10 days, but actually it's 9; from April 14 till April 22. Second - the hotel in Arenal volcano area - Eco Arenal is really chip, it's 2 star hotel, even owner said it. It's small, smelly rooms, and really bad breakfast - same food each day, no vegetables even tomatoes, cheese is processed no fresh one, one type of eggs- scrambled eggs and you could not put it on your plate yourself. No fresh baked goods like croissant and no yogurt. Tours are ok, but some of the guides do not have enough information or have bad English. My nightmare continues, I was added to another hotel that other group of people, and they are in 4 star hotel but not me. I am so disappointed."
2024-04-17,N/A,On my recent trip to Peru,"On my recent trip to Peru, their staff damaged my luggage and they have refused to replace or compensate me for the damage which I showed proof and alerted them to prior to departure on my last over night stay.  Will never travel with them again, especially since I have spent over $6,000 in travel with them.  Not worth it."
2024-04-16,N/A,Stay away from Exoticca.,"We are within 10 days of traveling to Iceland and Exoticca still has not yet corrected their error.  We have called them many times and emailed many times and they cannot figure out how to fix the problem.  Exoticca gave us a non-working PNR number and we still cannot access our flight on the airline's website.  We are unable to pay for our baggage, select a seat, and we cannot access our trip in order to check in 24 hours in advance of our flight.  Exoticca cannot figure out how to correct the problem.  Their suggested ""fix"" is that we go to Logan airport (Boston) and pay for our bags at the ticket counter, select our seats at the ticket counter and check in for the flight on the day of our flight at the ticket counter.  This is pathetic.  I will never travel with them again or recommend them to anyone else."
2024-04-15,N/A,Zero star,"Zero star. Absolute crap of a company and an ansolute nightmare of a trip. They booked the worst tickets. Basic of basic, we didn’t even have assigned seats and neither could we pay to upgrade our seats. You get no mileage for the tockets they book either.Their customer service is a joke. All on whatsapp like some scammy company that they are.Once we arrived to peru, they had scammed us once again. We booked a premium luxury private tours but they messed up our entire itinerary.Booked basic train tickets instead of vistadome. Had no guide for us at machu pichu. Then mixed up our itinerary days. Our trips were all cut short because they kept booking us basic tours instead of premium private tours that they already took the money for.By the end of it, i was just asking for the awful trip to end already so we can get home to USA.I should have read the reviews. Exoticca is an absolute scam of a company.Oh and they also promised checked bags but we kept getting plan tickets with no baggage included and paid upto $300 in fines to get our luggage through airports in peru.I will be reporting them to my bank for scamming me."
2024-04-10,N/A,We book 10 days to Greece with exotica,We book 10 days to Greece with exotica.   We paid extra and upgraded hotel rooms toSuperior But in Athens hotel was 3 stars and in Mykonos the hotel was 2 stars.  Very bad experience.I called Exoticca 5 to 6 times and was on hold for more then 2+ hours.Don’t waste your money with travel company.
2024-04-10,N/A,Absolutely the worst travel tour…,"Absolutely the worst travel tour company ever booked with. When calling Exoticca help line the wait time to speak with someone was incredibly long and when you finally got someone they couldn’t answer any questions. We did the Turkey adventure and did not realize Exoticca only acts as a contractor/broker with an in country company. In this case that company was far better than Exoticca but still had issues. Trying to get travel and in country information was very difficult. You have to wait to get an email 15-20 days prior with a help line number. When you call that number they want you to use WhatsApp to chat and each time on same chat you have to get putting in your booking number. Even then they never provided any real assistance. Our guide and bus driver from the in country tour company were good, as was the bus and most of the hotels. I would not recommend booking with Exoticca it is just too frustrating working with them. Guess you get what you pay for but in our case felt like we didn’t even get that."
2024-04-06,N/A,AVOID EXOTICCA LIKE THE PLAGUE,"I gave Exoticca a deposit of over $1800 for a trip. Weeks before the scheduled departure they canceled my reservation and refused to refund anything.Do not believe any nonsense with which they may respond. There are HUNDREDS OF COMPLAINTS against them listed on the Better Business Bureau site and they have a terrible rating. Trust their hundreds of complaining customers, not their paid PR representatives.P.S. Their response says they are “sorry to hear about” my cancelation when they alone are the one who canceled it! And they “remain at my disposal” by refusing to refund my money or make any attempt to satisfy my complaint. From what I read here, and the fact that hundreds of customers have complained to the Better Business Bureau, they are “sorry to hear about” many, many customers who ended up extremely unhappy for choosing Exoticca. No worries, though, because they will be “sorry to hear about” taking advantage of you too."
2024-04-05,N/A,We booked our 13 day long Peru trip,"We booked our 13 day long Peru trip, but learned that our flight ticket are basic economic which does not give us any option to buy any extra luggage. We also checked with air lines to sort things out but in vain, customer help is no help, not offering any help but keep saying you can buy at Airport, we checked with British airlines and came to know even we manage here in UK but as we have to take our luggage out at Miami, there is no guarantee as transfer time is short and places may be already full so we have to spend excessive amount of money if we do want to get our luggage back at home in UK again!!!!!"
2024-04-04,N/A,All Exoticca Tours are not Created Equal:  Beware,"Unlike our previous two trips with Exoticca, the Treasures of Sicily was a big disappointment.  In fact, if this had been my first trip with Exoticca, I would never travel with them again.  The local contracted tour company in Sicily was disorganized and chaotic; the tour was offered in 3 languages, so the English translation was somewhat limited; but what we found of greatest concern was the fact that Exoticca misrepresented and was deceptive in what was actually included in the tour.  The tour description described the many historical sites to be visited, and stated 'Included' on the travel brochure.  We were indeed driven to these various sites, but we were told by the tour guide that not a single admission fee was included in our package.  I tried contacting Exoticca Customer Service during our trip to make inquiries, but I was not provided with a response to my concerns.  Upon return home, I have contacted Exoticca Customer Service several times to try and get answers to my concerns, but again, there has been no response. This experience is so different from the other 2 trips with Exoticca, so it was a true disappointment.  I had hoped to avoid having to write a negative review, given my previous 2 very positive experiences.  Clearly, not all Exoticca tours are created equal in terms of experience."
2024-04-03,N/A,We travelled to Portugal in October and will be travelling to Jordan and Egypt,"We travelled to Portugal in October. Trip and arrangement by Exotica were satisfactory.Accordingly, we decide to take your tour to Jordan and Egypt in May. We also invited two more families to join us in this trip. But, we are very dissatisfied with the change of flight schedule. For the fourth time, Exotica decided to change our flight to Jordan. Now, flights are longer, and more stops. It is very frustrating.It is a regret that we are going to change our mind and never travel with this company again. Sorry, but it is not reasonable to change our flights four times for this upcoming trip."
2024-04-02,N/A,Customer Service don't care,"It's 4 of us in this trip. At our initial booking, the agent mispeld one of the names. Even thoulllgh we send a copy of the passports, they couldn't change it. Instead, they ask the person with the mispeld name to pay $1,700 to be in the flight.That was like half of what we paid for the trip.  Thankfully,  when I called Air Canada to choose a seat, and I asked her if she can changed the name of the person, (before this the personnel of United airlines said she'll change the name so I was relieved), but the United Airlines personnel doesn't know that she actually cannot change the name, but Air Canada knows that you can't and there's no way you can get a boarding pass. Air Canada personnel suggested that I should cancel the trip and re-book it. Thankfully,  we paid for cancellation and so we were able to re-book the trip to another day but it was $100. more because of the date. My concern was, why didn't the Customer Service of Exoticca told us the better way how to go about their mistake?Another thing, when we reached the hotel, they didn't honor our Early Check-in although we paid for it. We reached their at 8AM and didn't get in until 1pm. We also have to pay for our breakfast for $12.00 pp which should have been included with our early Check-in.  However,  Exoticca said they will refund what we paid for Early Check-in in 14 days."
2024-04-02,N/A,"Trips to Chile, Bolivia and Argentina","Six of us recently had three trips in South America that were continued one by one. The first trip was in Chile 7 days, the second in Bolivia 6 days and the third one in Argentina and Chile 11 days. We expected to have a main guide on each trip like we had in Ecuador 2 years ago (also Exotica trip) but we did not have anybody who would help us with all possible problems! There were problems with communication with Exotica offices in these countries. Most of local guides were very good except Alehandro in Santiago Chile and his driver who was driving like crazy! One moment it was 140 km/hour and we had to warn them. In Piedro Atacama hotel the staff, with very limited English, told us that we were not in their system and there are no rooms for us! Communication, by wats-up, with the exotica office in Santiago was hard to get and eventually after 45 unpleasant minutes a young lady found our names in the system! In short: it was great to see these beautiful countries but trips without guides who would be with us (like in G-adventure trips) all time I would not recommend. We will avoid to travel with Exotica again."
2024-03-30,N/A,Charging 640$ to correct Marie to Mary!,"I wrote 1 star review last week about being charged 400$ to make a minor name correction from Marie to Mary . On Monday March 25 I received a call from Lucette who told me the charge was not for a name change, but  if we opted to make a change to the final destination . She assured me there would only be a small fee for the correction . On March 29 I was informed by Lana the charge would now be 640$. They refused to let me speak to their ticketing department so we could have a conference call with Delta where I was told there is NO charge for a minor change . All our flights are on Delta and their partner Kenya Airways . Delta will not allow  me toMake the corrrection because Exoticca booked it . I have repeatedly asked the exoticca agents to change the name with Delta but to no avail ."
