date,rating,title,review_text
2024-09-14,N/A,Can't change flight without penalty,I am traveling with a friend. We both booked the trip within a short period of time of each other but from different locations. We accidentally booked the flights leaving an hour apart from each other. We called within minutes of discovering we weren't on the same flight but was told one of us would have to cancel our trip and re-book. Plus lose our travel insurance of $200. We find this to be excessive and inconvenient.
2024-09-12,N/A,Making the Decision to Use This company.,I always read reviews.  Good and bad.  All of them.  And then look at the common theme/thread in all of them.  The two that are most common here are being able to get through to people and the location/cleanliness of hotels.  These are both very big deals.  So I will not be booking with this company.
2024-09-12,N/A,The tour price was increased by $235…,"The tour price was increased by $235 per person  during the time of initiating & completing the booking process (2-3hrs). The price was not increased on Exoticca website until 3 days later. I did not realize the increase in per person cost until payment was made at the higher price. I called the agent back & was told ""there's nothing I can do"". I have since had 3 calls to customer service & have been told that I would receive a response in ""1-3 business days"" ""early next week"", and ""cannot confirm a date"". I have been waiting almost 2 weeks for a reply."
2024-09-14,N/A,AVOID STRESS: AVOID EXOTICCA,"REF:   EX2024231003Had to cancel a trip due to health reasons.The partial refund has taken over 3 weeks to be received.So far...It feels like accounting from the 1950sI should have realised ""you get what you pay for""...with Exoticca you pay cheap and get crap service.If you want to avoid unnecessary stress...avoid Exoticca"
2024-09-11,N/A,"Disaster trip in China, Spain Team","Hello, i would like to share with you this comments, due to my frustation with this company, especially the spanish team. I will not recommend this company to anyone in my whole life. We have booked a China trip with my parents and me. First of all, the schedule was a disaster, spending so much time in places, such as Shangái or Xian. Additionally, we have contracted an insurance and other advantages since we need to change our flights for any unforeseen events. In the following setences, it is what happens after this disaster planification. My aunt has to take a surgery and we try to change the flight for other flight, since we would like to be during the surgery if something happens. Even though all the contracted package of the trip, the only solution was to spend 3.000 dollars more for OTHER flights. I think It is ridiculous as the spanish team did not make an effort to help us. Therefore, i Will share this information to my close people, in order to cancel or choose any other company instead of Exoticca."
2024-09-11,N/A,Never again,"Never againThe guide did not tell the truth about distances on the coach , we will be there in 2 hours , wrong ,3 hours and people absolutely desperate for the toilet . Google maps told us exactly how long it would take !The guide toilet-shamed a lady on the microphone to the whole coach for needing the toilet by announcing repeatedly she has a toilet emergency ,disgusting behaviour which I discussed with him at length the following morning . I also asked for a toilet break every two hours during long journeys for the rest of the week as many people on our coach are pensionersThe guide dumped us for two hours at a petrol station where the boat comes in . We ate petrol station hotdogs which were very tasty and then after two hours he made us q nowhere near the entrance for the boat and every other group got on first so we had nowhere to sit outside on a two hour boat journey in 28 degrees . There was a Viking settlement at this petrol station , I don’t think any of the 36 passengers went in as it took one and a half hours to see the displays .The views on the boat were fabulous ,and the Flam railway was just how I imagined ,just lovely , my bucket list ticked right there . HOWEVER, we arrived in Bergen 3 hours later at 930 pmWe checked in and we got our keys first so we dumped the cases and ran to the centre to beg for dinner as most resturant kitchens had closed by now at 10 pm as it’s low season . The guide had said everything is open till 11 pm , Google info on all restaurants said 10 pm is the time the kitchens closed ,so many many people on the bus did not get dinner that nightThe guide was a chatterbox repeating himself many times but some info was completely wrong such as Lindisfarne is in Scotland . There were teachers on the bus who felt as I did and their knowledge is far greater than mine.A selection of rooms ,two were like tiny shoe boxes with no room for one suitcase let alone two ,one room was fabulous looking out onto the lake with water lapping all night long , one room was 12 th floor , fab view … all these rooms were spotlessly clean and had comfy beds and clean comfy pillowsAnd one room seemed like overflow for staff I think ,in the basement with a funny over mattress on top of an old saggy mattress . This room was also very cleanThe breakfasts were just lovely for me , l like cold meats ,cheese ,herrings, salad and freshly cooked breadMy partner prefers hot food which was not really available ,even the fried eggs covered in bacon were clap cold apart from the very last morning and the bacon and sausages were hot as it was a huge busy hotel with many guests .We don’t think we would recommend this trip to friends as there were too many negatives even though Norway is truly beautiful. The two evening meals provided were absolutely delicious and plentiful ,however did not contain the advertised fish so I was disappointed tbh.On the positive side the coach was full of delightful people , thoughtful and considerate and interesting and very funny . We were totally blessed with fabulous weatherAnd we did have a laugh with many of them who were from all over the world . I have made happy memories and my grandchildren love all my pictures but my partner has flatly refused to ever go on a coach holiday again , (although he did see a moose from the coach )Date of experience: 03 September 2024"
2024-09-11,N/A,Very rude rep when we request change…,"Very rude rep when we request change flight schedule. Evrn we get confirmed from Swiss airline Ms. Sam Wleez that our return to LAX can be changed, only thing they need is from sb in your company to call them. But your rep insisted that base on your policy. I need ask who need help? Me, your loyalty customer or we need serve you? It’s really ridiculous to your rep’s attitude, and even she hang up my phone call. I think if you need get mor le business, try your very best to help your customers is always No.1 priority. Am I right?"
2024-09-10,N/A,ZERO CUSTOMER SERVICE. AVOID.,"Really concerned that this company is a fraud and I've parted with a huge amount of money on what is supposed to be a huge trip of a lifetime. I have tried to contact customer services repeatedly to try to book an additional activity on my holiday, but no response, just automatic reply emails. I don't trust this company and will not be surprised if I find out that this company and the holiday doesn't exist. I can't get hold of anybody to speak to. Customer service is non-existent. I would not recommend based on the fact that after booking, there's no way of contacting anyone. I'm deeply worried."
2024-09-10,N/A,No customer service,"I called many times, line never rings, pressed “call me” before checkout to call, no call not surprised because that’s how I missed the first deal because waiting for a call and then prices went up and I’ve sent email, no emails back which was shocking but not as shocking as the fact that I didn’t receive a final confirmation email after I did put down an entire payment, makes me feel like the site isn’t legit even though I know it is but hoping the actual trip is good. Updates await."
2024-09-10,N/A,I found the booking process to be…,"I found the booking process to be confusing.   When I tried to call for help,  the line was always busy."
2024-09-10,N/A,Awful communication and customer…,Awful communication and customer service.
2024-09-09,N/A,I had to wait one hour to be answered.,No Content
2024-09-06,N/A,"""Zero"" customer service","After booking there was ""zero"" customer service. I want to make a change on my passport to provide my full name and despite calling 4 times and waiting over 20 minutes twice and over 30 minutes twice I still didn't get alive person and no voice mail. I tried using their site to ammend and it wouldnot accept. Called and got through to sales and although it wasn't their job explained my predicament and got forwarded to another number which didn't work. I made two bookings with my spouse one to Porugaland another to Turkey before I realized the problem with my passport first name. Hope my trips goes smoother. A very disappointing experience."
2024-09-06,N/A,Absolute nightmare,"Absolute nightmare. Never again. We paid for 4 star hotels. They put us in a church with no fans or AC.@exoticca - I wrote what I wrote. If people are blowing $5K on vacations they deserve to know the night before their Machu Picchu hike they will not rest well and you guys will not provide good service on your only communications, WhatsApp. My vacation may be garbage but I can help others@exoticca - we asked you to move us from hotels and you did nothing.For everyone else's awareness, and I can upload photos. The rooms have no fans, no ACs and the windows do not open which is a fire and safety hazard. Exoticca has our info and can reach out when they please. I can also upload the WhatsApp chat that literally says: we apologize for the inconvenience"
2024-09-04,N/A,Very Poor Customer Service,"A group of 10 of us have booked a trip tp Italy. When booking Exoticca said it was best to book in two separate bookings for cancellation purposes. They indicated that both groups would  have the same itinerary - same trains, same hotels etc. That is not the case as the groups are in different hotels. Exoticca has been contacted many times to rectify with no resolution & just getting the run around. Have indicated they are working on it but it has been over 4 weeks & still no resolution. Have asked to talk to a supervisor & was told they do not take calls. VERY POOR CUSTOMER SERVICE. Very disappointed with the entire process of booking this trip with Exoticca"
2024-09-04,N/A,Good tour choices but once we booked a…,"Good tour choices but once we booked a tour, there is no changes allowed without canceling the whole trip which we have already paid 60% that is non-refundable.   We can't even upgrade on hotels or change trip date.   Wish Exoticca would allow some flexibility."
2024-09-03,N/A,not responsive to solve the issue,"I gave the travel consultant my name during the phone booking on 8/ 24 and said I don't have the passport with me, but will provide my full information including passport number a week later. When I got home a week later on 8/27, under the Exoticca request, I immediately downloaded my passport and sent to them by email. This was done before they gave me any written confirmation for my Eqypt trip on 10/13. Now 5 days later, they want me to pay over the $500 extra penalty because I spelled my middle name 1 letter wrong over the phone which is different from my passport. They claimed airline want to charge me  the extra $500. Today, I called several time and left message to my travel consultant, she never called me back. This should never happened because I did not give them the passport number over the phone, only upload the copy of my passport in the email for them to book the flight ticket when I got home. Who likes to pay the extra $500 for changing the 1middle name 1 letter. I would like to see if they could solve the issue or changing to another time for the same itinerary trip. Dissapointed!"
2024-09-03,N/A,Trip to South Africa,Trip to South Africa.  I called several months prior to our Travel date to ask if we could switch my husband to another traveler due to him being sick. We were told we could not do that and if we cancelled the trip we would lose 60 percent. Me and my 3 children went on the trip we did not receive any compensation for my husband not even his seat on the plane. During the trip our guide was more worried about the tips he would receive continually telling us about tipping him and the bus driver. We did not have enough time when we did stop during traveling. He would give up 20 to 30 minutes to be back on the bus. Then on our way to Cape Town we were stuck in the airport for over 6 hours waiting for our plane. Other people in our group were able to leave 4 hours earlier than ours. We tried to leave earlier but would have been charged a lot of money. I was extremely disappointed with this trip. I have booked several trips with exoticca and had not been disappointed until this trip. I will definitely think twice prior to booking another trip.  Unfortunately prior to this trip I already booked a trip to Thailand.
2024-09-02,N/A,Bad Customer Service,"Comapny's Customer Service not good. I need hotel voucher for Visa to Cambodia. I sent request on line, no reply. I tried to contact over the phone, waited for 15 minutes, no reply. Again tried to contact some one, again waited but no reply. Just telephone goes ringing.Bad service."
2024-09-01,N/A,We were sold without full knowledge,When we were sold our trip there was absolutely no mention of Govt travel warnings or health vaccination recommendations - thus we were compelled to seek a refund - radio silence from the company - no response to my requests.
2024-08-30,N/A,Your salesperson sent me a voucher for…,"Your salesperson sent me a voucher for $400 off as she was making the sale.  However, she neglected to apply the voucher and now your customer service people are saying it's too late because it's already booked.  I'm very disappointed with this result.  In the past, I have found Exoticca to be good at following through with its deals."
2024-08-30,N/A,This is a terrible company,"This is a terrible company. They booked our hotels far outside the locations we were visiting. The hotels were all nice when the AC was working but 2 of the three hotels did not allow you to control your own AC. Oh and if you wanted to use the pool it wasn’t included and cost an extra 15 euros. The hotel in Venice was not in Venice it was in Mestre, which means an additional 25 euros to get to Venice and another to get back. The airline tickets were basic economy and it cost an additional 75 dollars to check a bag and if you wanted to select a seat it was an additional cost depending on what was available. We spent an unplanned 800+ dollars getting seats that weren’t all middle seats in the back and we (4 of us) were still not able to sit together.I will never ever do Exoticca again. A truly terrible experience. And it cost thousands more than expected."
2024-08-30,N/A,Exoticca stops communicating as soon as you pay in full,"Exoticca is very communicative until they have all your money, then they just fade into the woodwork. No phone number, no way to check on details of my upcoming trip."
2024-08-30,N/A,Booking system is flawed,Booking system is flawed. Does not allow you to book checked bags on flight. Before I booked I was told that I could book them direct with airline once booking is finalised. Turns out Airline doesn't allow this and I have to check them in at airport at an unknown price which looks like it could be three times the price of the flights. Multiple calls to Exoticca customer service including a request to book checked bags and/or change the flight price have resulted in consistent fobbing off and impossible to speak to anybody who is empowered to do anything. Can't cancel without losing a signifcant amount of money. Suggest everybody stay clear of Exoticca.
2024-08-29,N/A,Rip off,"Right after I made a booking, the price went down $600 on the Exoticca website for the same trip. I did not even receive an email confirmation yet, so I immediately called the company but they said that they could not do anything to help me."
2024-08-28,N/A,Useless Customer Service,"I travelled to Portugal with Exoticca a month ago.Ecoticca failed to meet me at the airport at 1am, sending a helpless email instead, saying that as my flight (that Exoticca booked!) was delayed, them, who are supposed to be professional tour operator, could not get information on when my flight would land, and for logistical reasons they could not meet me. So they simply left me on my own in the middle of the night in a completely unknown city when I did not speak the language.Moreover, now, a month later, they didn't bother even to refund me the taxi fare.Terrible useless incompetent customer service.Shame!!!"
2024-08-27,N/A,Agent didn't follow previous…,Agent didn't follow previous instructions. Booked flights that were earlier than discussed having me to fly in a day earlier and pay for hotel rooms. When I tried to get a hold of agent she would not respond. Requested a manager call me with no response. Very disappointed.  No support after the sale.
2024-08-26,N/A,Didn’t allow changes within first hour of…,Didn’t allow changes within first hour of purchase! Unbelievable. Never again
2024-08-25,N/A,Exelente you are amazing,Exelente you are amazing
2024-08-25,N/A,Utter shambles,"Utter shambles! was lead through the process with an agreed fixed price, passport details etc taken then told we needed to pay an additional £500!! After refusing & going through customer service, we finally got the deal. Now, having been promised it would be easy to book & pay for the missing hold luggage (could not apparently be added at the point of sale) The carrier has told us its not possible & we may well have to book & pay at each (6) airport Lise, lies & more lies! Looks like another fight with customer service is looming & we havent even got to the airport yet"
2024-08-24,N/A,"We have done many trips with exotica ,","We have done many trips with exotica ,The customer service is terrible, it is very hard to communicate with their office when you have questions, they offer cheap hotel far from city center a meals not offered and  if offered bad quality.Guides hardly speak English, I will like a company that I can communicate easily to book and service, most tours are optional and way over priced."
2024-08-25,N/A,No customer service at weekend,"No customer service at weekend. My flight/trip starts on Mon 26 Aug but there is an issue with the flight. Exoticca website provides a number to call if your trip is leaving within a couple of days so it can be prioritised. However, when you phone it says to phone back on Mon. There is no agent available to resolve the flight issue so unsure if able to join the tour on time. This is not good enough.Update - Sun 25 Aug: Exoticca’s website does not provide any mention of an emergency team or telephone line. Instead the advice is ‘If your request concerns a trip that is departing in the next few days, please contact us on +44 20 80683176 so we can prioritize your trip accordingly’. When you phone this number and select the ‘Customer Service’ option, the automated message is that this service is only available from Monday. Hence the headline for this review ‘No customer service at the weekend’. Although Customer Services have since being in communication, the advice is worrying. The flights Exoticca booked for me allow approx. 1-hour connection time during which I have to first disembark from the 1st flight and then as per the airline’s advice ‘clear customs, pick up checked baggage and recheck your bags before heading to your next gate’. This is impossible and contrary to the airlines (and standard airline industry) advice that passengers should arrive at least 3 hours before departure. As the connection time is insufficient, I will miss my connecting flights and also the start of the tour. Unreassuringly, Exoticca’s response is that 1 hour is sufficient time for connecting flight even though this is contrary to the airline’s 3-hour advice and the established 3-hour recommended arrival time within the airline industry. The problem is unresolved and I leave tomorrow morning at 6am."
2024-08-23,N/A,READ BEFORE Booking the 11 Day…,"READ BEFORE Booking the 11 Day Adventure in ITALY.There are so many misrepresentations on this tour and Exoticaa (blames the local tour company) takes no responsibility to correct the descriptions.  I paid for extra tours that never happened and they refused to refund my money.  I paid for ""superior"" category, there is absolutely no difference in accommodations and everyone stays in the same hotels and others had better rooms and bathrooms than we did.  You are essentially on your own on this tour.  There is no guide. They do not have time set aside or included for you to go into any of the basilicas, cathedrals or churches.  They also don't disclose that. They don't provide transportation in most instances. You have to manage that by yourself in a country where you don't speak the language and you assumed you were part of a guided tour.. Go with a different tour company that takes care of its travelers and doesn't mis lead them."
2024-08-23,N/A,Beware ExoticcaThe 'in country partners' who actually…,"The 'in country partners' who actually conducted the tours - havwe so far been good to excellent ... some exceptionally so.However - dealing with Exoticca itself has been a very costly, time consuming nightmare for me.They double charged me for a package to Peru - which was excellent.However, not so good that I want to pay for it 2x.They will not refund the cost of one of the trips done because of incorrect information provided to me by Exoticca staff member Dan.That trip was $3546. (and excellent value for the $ - except I paid for it twice due to an error done by Exoticca staff).I have applied to the BC Conflict Resolution Tribunal to have those funds returned to me ... and so far they have only returned a small portion.Hence I am going to proceed with the conflict resolution through the BC Conflict Resolution Panel.Unlike Intrepid - when I made an error with them - because of Exoticca staff misinformation - I explained the situation and they instantly refunded the full cost of the tour on the next credit card bill.With Exoticca - it is very piecemeal. And frustrating, and so very unnecessary.They just want me and others like me to go away while they keep our hard earned $.Even returning from Morocco ... they sent me a voucher that the hotel in Madrid would not honour.The hotel staff ... even though I had a copy of the voucher on my phone - said that it was made for the 16th of the month not the 18th.Exoticca - rather than going after that hotel ... and getting reimbursed ... refuses to reimburse me for the hotel in Madrid ($212+ Cdn $) and instead sent me a copy of the voucher that I had on my phone that the hotel in Madrid would not honour.And I had to wait hours to be picked up at the airport by the hotel service ... as they had me coming in on the 16th and not the 18th.To me - they should be getting their funds back from the hotel and not harassing me.The  return flight was a from Morocco to Vancouver was a nightmare that took the better part of 3 days ... rather than the flight that was sent to me with my itinerary - which went Morroco, London, Vancouver and took less than 1 day.To date - they will not reimburse me for the full cost of the hotel. They insist on giving me Can$ for the amount I was charged in Euros.There is quite a difference - over Can$55.For the double payment for the excellent trip to Peru ... which was the result of an Exoticca staff person giving me the wrong information ... they have reimbursed me less than 50% ... and that only after I submitted a claim into the BC Conflict Resolution Tribunal (for claims under $5000. which go into Small Claims Court).I am still in the process of getting hotel and dinner covered from the changes THEY made to my return ticket from Morocco (a fabulous tour).I love the model - that Exoticca is providing global exposure to really excellent in country tours that enable local tour companies and guides to show off their countries.I do not like that they do not meet industry standards in Canada ... and that they are so very obstructionist."
2024-08-22,N/A,Poor customer service,Update on previous review….When I booked my 2 week holiday with Exoticca I was told that the flights were hand luggage only but that adding hold luggage would be very easy to do as soon as the booking was actually confirmed.It now turns out that I cannot do this and I have complained to Exoticca and asked them to reimburse me for the significant additional cost and inconvenience of adding the luggage at the check in desk on our day of departure which is now our only option.I have asked them 3 times now to reimburse me for this cost but all they will offer is £100 off of a future holiday booked with them.I think this is unacceptable as they admit they were in the wrong and acknowledge that I booked the holiday based on false information but seemingly just don’t care.I won’t book another holiday with them - that’s for sure.
